{
  "$schema": "https://repos-json.github.io/repos-json/schema/repo.schema.json",
  "name": "acme platform",
  "description": "Web, API and infrastructure in one tree",
  "icon": [
    { "src": "brand/mark.svg", "sizes": "any" },
    { "src": "brand/mark-512.png", "sizes": "512x512", "type": "image/png" },
    { "src": "brand/mark-192.png", "sizes": "192x192", "type": "image/png" }
  ],
  "color": {
    "primary": "#1d4ed8",
    "accent": "#f59e0b",
    "background": "#0b1020"
  },
  "homepage": "https://acme.example"
}
